{"format":"orcon/flow@1","id":"01930000-0000-7000-8000-0000000000aa","name":"HTTP Request cases","description":"Imported from n8n. Review the import report before you publish.","settings":{"branchMode":"SEQUENTIAL"},"variables":[],"nodes":[{"id":"h1","name":"Get quotes","element":"serviceTask","type":"orcon.http@1","parameters":{"method":"GET","url":"https://api.example.test/quotes?status=open&limit=20","headers":{"Accept":"application/json"}},"ext":{"orcon.import":{"n8nType":"n8n-nodes-base.httpRequest","n8nTypeVersion":4.2,"n8nNodeId":"h1"}}},{"id":"h2","name":"Create ticket","element":"serviceTask","type":"orcon.http@1","parameters":{"method":"POST","url":"https://api.example.test/tickets","body":{"title":"Lead","priority":2},"credential":"Ticket token"},"ext":{"orcon.import":{"n8nType":"n8n-nodes-base.httpRequest","n8nTypeVersion":4.2,"n8nNodeId":"h2","reviewStatus":"NEEDS_REVIEW","reviewReasons":["HTTP_WRITE"]}}},{"id":"h3","name":"Dynamic url","element":"serviceTask","type":"orcon.unsupported@1","parameters":{},"ext":{"orcon.import":{"n8nType":"n8n-nodes-base.httpRequest","n8nTypeVersion":4.2,"n8nNodeId":"h3","original":{"id":"h3","name":"Dynamic url","type":"n8n-nodes-base.httpRequest","typeVersion":4.2,"position":[400,0],"parameters":{"method":"GET","url":"={{ $json.url }}","options":{}}}}}},{"id":"h4","name":"Expression method","element":"serviceTask","type":"orcon.unsupported@1","parameters":{},"ext":{"orcon.import":{"n8nType":"n8n-nodes-base.httpRequest","n8nTypeVersion":4.2,"n8nNodeId":"h4","original":{"id":"h4","name":"Expression method","type":"n8n-nodes-base.httpRequest","typeVersion":4.2,"position":[600,0],"parameters":{"method":"={{ $json.method }}","url":"https://api.example.test/ping","options":{}}}}}},{"id":"h5","name":"Form upload","element":"serviceTask","type":"orcon.unsupported@1","parameters":{},"ext":{"orcon.import":{"n8nType":"n8n-nodes-base.httpRequest","n8nTypeVersion":4.2,"n8nNodeId":"h5","original":{"id":"h5","name":"Form upload","type":"n8n-nodes-base.httpRequest","typeVersion":4.2,"position":[800,0],"parameters":{"method":"POST","url":"https://api.example.test/upload","sendBody":true,"contentType":"form-urlencoded","specifyBody":"keypair","bodyParameters":{"parameters":[{"name":"file","value":"a"}]},"options":{}}}}}},{"id":"h6","name":"With timeout","element":"serviceTask","type":"orcon.unsupported@1","parameters":{},"ext":{"orcon.import":{"n8nType":"n8n-nodes-base.httpRequest","n8nTypeVersion":4.2,"n8nNodeId":"h6","original":{"id":"h6","name":"With timeout","type":"n8n-nodes-base.httpRequest","typeVersion":4.2,"position":[1000,0],"parameters":{"method":"GET","url":"https://api.example.test/slow","options":{"timeout":5000}}}}}},{"id":"h7","name":"Delete record","element":"serviceTask","type":"orcon.http@1","parameters":{"method":"DELETE","url":"https://api.example.test/records/9"},"ext":{"orcon.import":{"n8nType":"n8n-nodes-base.httpRequest","n8nTypeVersion":4.2,"n8nNodeId":"h7","reviewStatus":"NEEDS_REVIEW","reviewReasons":["HTTP_WRITE"]}}},{"id":"h8","name":"Old version","element":"serviceTask","type":"orcon.unsupported@1","parameters":{},"ext":{"orcon.import":{"n8nType":"n8n-nodes-base.httpRequest","n8nTypeVersion":3,"n8nNodeId":"h8","original":{"id":"h8","name":"Old version","type":"n8n-nodes-base.httpRequest","typeVersion":3,"position":[1400,0],"parameters":{"requestMethod":"GET","url":"https://api.example.test/old"}}}}}],"edges":[],"editor":{"nodes":{"h1":{"x":0,"y":0},"h2":{"x":200,"y":0},"h3":{"x":400,"y":0},"h4":{"x":600,"y":0},"h5":{"x":800,"y":0},"h6":{"x":1000,"y":0},"h7":{"x":1200,"y":0},"h8":{"x":1400,"y":0}}}}